author,title,description,url,source,image,category,language,country,published_at
GlobeNewswire,Center Coast Brookfield MLP & Energy Infrastructure Fund Announces Changes to Portfolio Management Team and Portfolio Manager Update Webcast,"NEW YORK, Oct. 20, 2021 (GLOBE NEWSWIRE) &#8212; Center Coast Brookfield MLP & Energy Infrastructure Fund (NYSE: CEN) (the “Fund”) today announced changes to the portfolio management team at Brookfield Public Securities Group LLC (“Brookfield”), the investment adviser to the Fund. The Fund also announced the next quarterly webcast. Changes to Portfolio Management TeamMessrs. Robert [&#8230;]",https://financialpost.com/globe-newswire/center-coast-brookfield-mlp-energy-infrastructure-fund-announces-changes-to-portfolio-management-team-and-portfolio-manager-update-webcast,Financial Post | Canada Business News,,business,en,us,2021-10-20T22:03:56+00:00
Reuters,"Workers at Exxon Texas refinery reject contract, lockout continues","BEAUMONT &#8212; The two sides in the Exxon Mobil Beaumont, Texas, refinery standoff on Wednesday were back to square one after workers soundly rejected the company&#8217;s sweetened contract offer. Exxon for months pushed the United Steelworkers union to put the company&#8217;s contract proposal to a vote, and the defeat meant a six-month lockout will continue. [&#8230;]",https://financialpost.com/pmn/business-pmn/workers-at-exxon-texas-refinery-reject-contract-lockout-continues,Financial Post | Canada Business News,,business,en,us,2021-10-20T22:11:57+00:00
,Cinemark enhances moviegoing experience with Snacks in a Tap advance ordering feature,Cinemark enhances moviegoing experience with Snacks in a Tap advance ordering feature,https://seekingalpha.com/news/3755883-cinemark-enhances-moviegoing-experience-with-snacks-in-a-tap-advance-ordering-feature?utm_source=feed_news_all&utm_medium=referral,Seeking Alpha,,business,en,us,2021-10-20T22:23:56+00:00
Aria Alamalhodaei,Tesla will only use iron-based batteries for standard model EVs,"Tesla said Wednesday it will use iron-based batteries for its standard Model 3 and Model Y models across global markets. The update, provided in the company&#8217;s third-quarter earnings report, confirmed hints that Tesla CEO Elon Musk has been dropping for months about the cheaper battery chemistry&#8217;s growing role in the company&#8217;s product line-up. Lithium-iron-phosphate (LFP) [&#8230;]",https://techcrunch.com/2021/10/20/tesla-earnings-iron-batteries-evs-globally/,TechCrunch,,technology,en,us,2021-10-20T22:55:23+00:00
Indu Bhan,Future Retail party to dispute with Amazon: Arbitration panel,This stance of the arbitration panel further bolsters Amazon's stand that FRL violated contractual agreement by signing a merger deal with Reliance Retail.,https://www.financialexpress.com/industry/future-retail-party-to-dispute-with-amazon-arbitration-panel/2353704/,The Financial Express,https://images.financialexpress.com/2021/10/amazon-2.jpg,business,en,us,2021-10-20T23:01:00+00:00
Reuters,Qantas expects return to 100% of pre-pandemic domestic capacity by January,"SYDNEY &#8212; Qantas Airways Ltd expects to get back to flying 100% of its pre-COVID-19 domestic capacity by January as Australian state borders open up due to surging vaccination rates, the airline&#8217;s chief executive said on Thursday. &#8220;It looks like by Christmas we will have every state open except for Western Australia, and Western Australia [&#8230;]",https://financialpost.com/pmn/business-pmn/qantas-expects-return-to-100-of-pre-pandemic-domestic-capacity-by-january-2,Financial Post | Canada Business News,,business,en,us,2021-10-20T23:22:08+00:00
Jiya Saini,Experts identify a new drug that can help diabetic patients recover faster after heart attack,"A new study by the University of Oxford&#8217;s researchers&#160;has found&#160;a drug that may&#160;help repair heart function in diabetics who have heart attacks. According to the study sponsored&#160;by the British Heart Foundation and published in the journal Diabetes, the drug, which is now in clinical trials as a potential therapy for a kind of anaemia, could [&#8230;]The post Experts identify a new drug that can help diabetic patients recover faster after heart attack appeared first on Revyuh.",https://www.revyuh.com/news/lifestyle/health-and-fitness/experts-find-a-new-drug-that-can-help-diabetic-patients-recover-faster-after-heart-attack/,Revyuh Media,,business,en,us,2021-10-20T23:34:06+00:00
Rebecca Bellan,"Tesla has 150,000 cars using its safety score tool","Nearly 150,000 Tesla cars are using the company&#8217;s new &#8220;safety score,&#8221; a tool rolled out last month to determine whether owners can access the beta version of its “Full Self-Driving” software, executives said during its third quarter earnings call. While 150,000 cars are now part of the Full-Self Driving (FSD) beta enrollment program, a fraction of drivers have [&#8230;]",https://techcrunch.com/2021/10/20/tesla-third-quarter-earnings-safety-score/,TechCrunch,,technology,en,us,2021-10-21T00:43:57+00:00
STEVE IDUH,What Nigerians can benefit from having multiple residencies and citizenships,"As countries open up for travel and visits, there can be no better time to leverage opportunities provided by various states for businesses and investments than now. Part of the way to have unlimited access to opportunities that exist in other countries is by having a second residency or citizenship. Some benefits of second citizenship [&#8230;]",https://businessday.ng/opinion/article/what-nigerians-can-benefit-from-having-multiple-residencies-and-citizenships/,Businessday | News You Can Trust,,business,en,us,2021-10-21T00:44:46+00:00
Brad Plumer,"Transition Away From Fossil Fuels Not Moving Fast Enough, New Report Finds","The world has made progress in the fight against climate change, with wind, solar and other clean technologies taking off. But more is needed to avert catastrophe, a new report finds.",https://www.nytimes.com/2021/10/13/climate/global-fossil-fuel-use.html,The New York Times,https://static01.nyt.com/images/2021/10/13/climate/13cli-energy1/13cli-energy1-moth.jpg,business,en,us,2021-10-21T00:58:49+00:00
Reuters,Oil extends gains as U.S. crude inventory draw points to strong demand,"TOKYO &#8212; Oil prices rose on Thursday to extend gains from the previous session as U.S. crude and fuel inventories tightened further, with supplies of gasoline hitting a two-year low, pointing to strong demand. Brent crude futures climbed 17 cents, or 0.2%, to $85.99 a barrel at 0040 GMT, after rising 0.9% the previous day. [&#8230;]",https://financialpost.com/pmn/business-pmn/oil-extends-gains-as-u-s-crude-inventory-draw-points-to-strong-demand,Financial Post | Canada Business News,,business,en,us,2021-10-21T01:07:23+00:00
Andreea Papuc,Stocks Mixed Amid Inflation Concerns; Dollar Lower: Markets Wrap,Stocks Mixed Amid Inflation Concerns; Dollar Lower: Markets Wrap,https://www.bloombergquint.com/markets/asian-stocks-set-for-steady-start-dollar-declines-markets-wrap,Bloomberg | Latest And Live Business,,business,en,us,2021-10-21T01:27:49+00:00
Bloomberg News,"China Evergrande Ends Talks on Hopson Deal, Asks to Resume Trading","China Evergrande Ends Talks on Hopson Deal, Asks to Resume Trading",https://www.bloombergquint.com/business/evergrande-ends-talks-on-hopson-deal-asks-to-resume-trading,Bloomberg | Latest And Live Business,,business,en,us,2021-10-21T01:31:52+00:00
Swati Pandey Mehra,Australian Central Bank Faces Pressure to Follow Fed With Framework Review,Australian Central Bank Faces Pressure to Follow Fed With Framework Review,https://www.bloombergquint.com/global-economics/australian-central-bank-faces-pressure-to-follow-fed-with-review,Bloomberg | Latest And Live Business,,business,en,us,2021-10-21T01:50:31+00:00
Marcus Wong,Long Philippine Bonds Seen Out of Favor on Inflation Fears,Long Philippine Bonds Seen Out of Favor on Inflation Fears,https://www.bloombergquint.com/onweb/long-philippine-bonds-seen-out-of-favor-on-inflation-fears,Bloomberg | Latest And Live Business,,business,en,us,2021-10-21T01:56:12+00:00
Damian Shepherd,Climate Change Threatens to Spread Viruses Through an Unprepared World,Climate Change Threatens to Spread Viruses Through an Unprepared World,https://www.bloombergquint.com/global-economics/climate-change-threatens-to-spread-viruses-through-an-unprepared-world,Bloomberg | Latest And Live Business,,business,en,us,2021-10-21T02:00:44+00:00
,"Uttarakhand rains: 52 people dead, 5 still missing",Most of the deaths were due to house collapses - an official statement said 46 of them suffered damage. Twenty-eight of the deaths were in Nainital district alone.,https://www.businesstoday.in/latest/top-story/story/uttarakhand-rains-52-people-dead-5-still-missing-309960-2021-10-21?utm_source=rssfeed,Business Today | Latest Stock Market And Economy News India,,business,en,in,2021-10-21T02:35:08+00:00
,"Buy Bharti Airtel, Mazagon Dock for near term gains; Nifty expected to witness more weakness ahead",The short term trend of Nifty continues to be negative and there is a possibility of some more weakness in the next 1-2 sessions before showing any convincing upside bounce from the lows.,https://www.financialexpress.com/market/cafeinvest/buy-bharti-airtel-mazagon-dock-for-near-term-gains-nifty-expected-to-witness-more-weakness-ahead/2353769/,The Financial Express,https://images.financialexpress.com/2021/10/Chart.jpg,business,en,us,2021-10-21T02:44:00+00:00
,Govt issues revised travel guidelines for international visitors,"Travellers from South Africa, Brazil, Bangladesh, Botswana, China, Mauritius, New Zealand Zimbabwe and countries in Europe, including the UK, would need to follow additional measures on arrival.",https://www.businesstoday.in/coronavirus/story/govt-issues-revised-travel-guidelines-for-international-visitors-309961-2021-10-21?utm_source=rssfeed,Business Today | Latest Stock Market And Economy News India,,business,en,in,2021-10-21T02:50:08+00:00
Vishwanath Nair,Hurtling To The Ground: An Insider's View Of Jet Airways Resolution,Hurtling To The Ground: An Insider's View Of Jet Airways Resolution,https://www.bloombergquint.com/business/hurtling-to-the-ground-an-insiders-view-of-jet-airways-resolution,Bloomberg | Latest And Live Business,,business,en,us,2021-10-21T02:54:51+00:00
Jeong-Ho Lee,South Korea to Launch New Rocket as Arms Race Builds Across Asia,South Korea to Launch New Rocket as Arms Race Builds Across Asia,https://www.bloombergquint.com/politics/south-korea-to-launch-new-rocket-as-arms-race-builds-across-asia,Bloomberg | Latest And Live Business,,business,en,us,2021-10-21T02:51:43+00:00
Patrick Winters,Shares Dive on Developer’s Failed Stake Sale: Evergrande Update,Shares Dive on Developer’s Failed Stake Sale: Evergrande Update,https://www.bloombergquint.com/global-economics/shares-to-resume-trading-after-deal-talks-end-evergrande-update,Bloomberg | Latest And Live Business,,business,en,us,2021-10-21T02:51:10+00:00
Reuters,Japanese shares fall as techs track Nasdaq’s weak finish,"TOKYO &#8212; Japanese shares fell on Thursday as the Nasdaq&#8217;s weak overnight finish hurt risk appetite, prompting investors to sell heavyweight technology stocks, but expectations for strong earnings results from domestic firms limited losses. The Nikkei share average was down 0.30% to 29,167.69 by 0211 GMT, while the broader Topix fell 0.26% to 2,022.30. Overnight, [&#8230;]",https://financialpost.com/pmn/business-pmn/japanese-shares-fall-as-techs-track-nasdaqs-weak-finish,Financial Post | Canada Business News,,business,en,us,2021-10-21T02:57:19+00:00
zee business,"Momentum Pick: IRCTC investors lose Rs 30,000 cr in two trading sessions as stock falls 31% - Check fundamental, technical views","Investors of Indian Railway Catering and Tourism Corporation Limited (IRCTC) lost around 30,000 cr in 2 trading sessions. The stock declined by Rs 930 or 17.3 per cent per equity share in value, on Wednesday.",https://www.zeebiz.com/companies/news-momentum-pick-investors-lose-rs-30000-cr-in-two-trading-sessions-as-irctc-stock-falls-31-analysts-give-fundamental-technical-view-168354,Zee Business,,business,en,us,2021-10-21T02:57:21+00:00
Bharath Rajeswaran,"Share Market Live: SGX Nifty Hints At Opening Gains; Asian Paints, JSW Steel, TVS Motor, Mphasis In Focus","Share Market Live: SGX Nifty Hints At Opening Gains; Asian Paints, JSW Steel, TVS Motor, Mphasis In Focus",https://www.bloombergquint.com/markets/share-market-live-sgx-nifty-hints-at-opening-gains-asian-paints-jsw-steel-tvs-motor-mphasis-in-focus,Bloomberg | Latest And Live Business,,business,en,us,2021-10-21T02:58:58+00:00
Patrick Hatch,Crown caned over $10m payout for ousted executives,"Crown Resorts shareholders have reprimanded the casino giant’s board, with almost 31 per cent of votes at the annual general meeting cast against its remuneration report.",https://www.theage.com.au/business/companies/crown-caned-over-10m-payout-for-ousted-executives-20211021-p591xl.html?ref=rss&utm_medium=rss&utm_source=rss_business,The Age,,business,en,au,2021-10-21T02:57:32+00:00
zee business,Stocks to buy: List of 20 shares that can give you good profit today; check target prices,The Indian markets closed with losses amid selling pressure on Wednesday for the second consecutive session,https://www.zeebiz.com/market-news/news-stocks-to-buy-list-of-20-shares-that-can-give-you-good-profit-today-check-target-prices-168360,Zee Business,,business,en,us,2021-10-21T03:22:10+00:00
Surbhi Jain,"SGX Nifty up, Nifty support, Bank Nifty technicals, stocks under F&O ban; key things to watch out today","Stocks such as Amara Raja Batteries, Escorts, Vodafone Idea, IRCTC, L&T Finance Holdings, NALCO, Punjab National Bank, SAIL, Sun TV Network and Tata Power were under the F&O ban for 21 October 2021",https://www.financialexpress.com/market/sgx-nifty-up-nifty-support-bank-nifty-technicals-stocks-under-fo-ban-key-things-to-watch-out-today/2353809/,The Financial Express,https://images.financialexpress.com/2021/10/StockIPOreuters-1.jpg,business,en,us,2021-10-21T03:28:00+00:00
,Govt says India is exporting strictly non-GM rice,The clarification from the commerce ministry came following a news report regarding food recall linked to alleged GM rice from India.,https://www.businesstoday.in/latest/trends/story/govt-says-india-is-exporting-strictly-non-gm-rice-309966-2021-10-21?utm_source=rssfeed,Business Today | Latest Stock Market And Economy News India,,business,en,in,2021-10-21T03:35:07+00:00
zee business,"Opening Bell: Nifty open near 18,400, Sensex reclaims 61,500","Indian equity benchmarks opened with gains as Nifty50 and S&P BSE Sensex started Thursday's session at 18,382.70 and 61,557.94 points respectively.",https://www.zeebiz.com/market-news/news-opening-bell-nifty-open-near-18400-sensex-reclaims-61500-168363,Zee Business,,business,en,us,2021-10-21T03:53:34+00:00
,"Australia should change laws to accommodate crypto, its Senate committee says","Australia needs to introduce new regulations for digital asset miners, such as tax discounts and a licensing regime for crypto exchanges, a Senate report said.",https://www.cnbc.com/2021/10/21/australia-on-changing-laws-to-accommodate-cryptocurrencies.html,Cnbc | World Business News Leader,,business,en,us,2021-10-21T03:31:00+00:00
Romain Dillet,Customer engagement platform Batch raises $23 million after years of bootstrapping,"If you’ve been working in the French tech ecosystem, you may remember a startup called AppGratis. The app discovery and promotion startup basically had to stop operating overnight following a long and nasty fight with Apple. From the team that brought you AppGratis, Batch is a customer engagement platform that has been operating under the [&#8230;]",https://techcrunch.com/2021/10/20/customer-engagement-platform-batch-raises-23-million-after-years-of-bootstrapping/,TechCrunch,,technology,en,us,2021-10-21T04:00:13+00:00
Dina Khrennikova,Russia Is Worried Surging Gas Prices Risk Destroying Demand,Russia Is Worried Surging Gas Prices Risk Destroying Demand,https://www.bloombergquint.com/onweb/russia-is-worried-surging-gas-prices-risk-destroying-demand,Bloomberg | Latest And Live Business,,business,en,us,2021-10-21T04:00:10+00:00
Bloomberg News,China Developers Rally on Confidence From Regulators’ Remarks,China Developers Rally on Confidence From Regulators’ Remarks,https://www.bloombergquint.com/china/china-developers-rally-on-confidence-from-regulators-remarks,Bloomberg | Latest And Live Business,,business,en,us,2021-10-21T04:10:31+00:00
Chris Kay,India Races to Vaccinate All Adults After Hitting Billion Doses,India Races to Vaccinate All Adults After Hitting Billion Doses,https://www.bloombergquint.com/global-economics/india-races-to-vaccinate-all-adults-after-hitting-billion-doses,Bloomberg | Latest And Live Business,,business,en,us,2021-10-21T04:45:10+00:00
ICICI Securities,Havells India Q2 Review - Strong Volume Led Revenue Growth: ICICI Securities,Havells India Q2 Review - Strong Volume Led Revenue Growth: ICICI Securities,https://www.bloombergquint.com/research-reports/havells-india-q2-review-strong-volume-led-revenue-growth-icici-securities,Bloomberg | Latest And Live Business,,business,en,us,2021-10-21T04:54:54+00:00
Monika Yadav,India administers 100 crore vaccinations to achieve landmark milestone,Over 20 lakh workers at 4.3 lakh vaccination centres helped achieve the feat over a period of nine months,https://www.thehindubusinessline.com/news/india-administers-100-crore-vaccinations-to-achieve-landmark-milestone/article37102870.ece,Business Line,,business,en,us,2021-10-21T04:51:19+00:00
Business Wire,"Tigo Energy to Showcase Solutions for Roof Space Usage, Monitoring, and Safety at Key Energy","Italian tradeshow features the Tigo Flex MLPE product range and module-level monitoring platform. MONTEVARCHI, Italy &#8212; Tigo Energy, Inc., the solar industry’s worldwide leader in Flex Module Level Power Electronics (MLPE), today announced the Company’s presence as an exhibitor at the upcoming Key Energy in Rimini, Italy. Tigo representatives will showcase all of its TS4 [&#8230;]",https://financialpost.com/pmn/press-releases-pmn/business-wire-news-releases-pmn/tigo-energy-to-showcase-solutions-for-roof-space-usage-monitoring-and-safety-at-key-energy,Financial Post | Canada Business News,,business,en,us,2021-10-21T05:00:08+00:00
BQ Desk,India Administers 100 Crore Covid-19 Vaccine Doses,India Administers 100 Crore Covid-19 Vaccine Doses,https://www.bloombergquint.com/coronavirus-outbreak/india-administers-100-crore-covid-19-vaccine-doses,Bloomberg | Latest And Live Business,,business,en,us,2021-10-21T05:01:18+00:00
Kamaron Leach,China Tech ETF Balloons to Record Size as U.S. Cash Floods In,China Tech ETF Balloons to Record Size as U.S. Cash Floods In,https://www.bloombergquint.com/china/china-tech-etf-balloons-to-record-size-as-u-s-cash-floods-in,Bloomberg | Latest And Live Business,,business,en,us,2021-10-21T05:11:31+00:00
Bloomberg News,Ukraine Seen Holding Rates But IMF Sows Doubt: Decision Guide,"(Bloomberg) &#8212; Sign up for the New Economy Daily newsletter, follow us @economics and subscribe to our podcast. Ukraine is expected to keep a promise to leave borrowing costs untouched, though remarks this week by the International Monetary Fund have some wondering whether a fifth interest-rate increase of 2021 could yet materialize. The issue at hand is inflation, which [&#8230;]",https://financialpost.com/pmn/business-pmn/ukraine-seen-holding-rates-but-imf-sows-doubt-decision-guide,Financial Post | Canada Business News,,business,en,us,2021-10-21T05:12:11+00:00
IDBI Capital,"Jubilant FoodWorks Q2 Review - Beat Estimates; Delivery, Takeaway Sustains Momentum: IDBI Capital","Jubilant FoodWorks Q2 Review - Beat Estimates; Delivery, Takeaway Sustains Momentum: IDBI Capital",https://www.bloombergquint.com/research-reports/jubilant-foodworks-q2-review-beat-estimates-delivery-takeaway-sustains-momentum-idbi-capital,Bloomberg | Latest And Live Business,,business,en,us,2021-10-21T05:01:01+00:00
Molly Smith,"Digital Dollar Could Overwhelm Local Currencies, Rajan Warns","Digital Dollar Could Overwhelm Local Currencies, Rajan Warns",https://www.bloombergquint.com/crypto/digital-dollar-could-overwhelm-local-currencies-rajan-warns,Bloomberg | Latest And Live Business,,business,en,us,2021-10-21T05:30:12+00:00
Reuters,"Gulf economies to pick up speed next year, with fall in oil prices biggest risk: Reuters poll","Gulf economies to pick up speed next year, with fall in oil prices biggest risk: Reuters poll",https://www.investing.com/news/economy/gulf-economies-to-pick-up-speed-next-year-with-fall-in-oil-prices-biggest-risk-reuters-poll-2650430,Investing.com | Stock Market Quotes &amp; Financial News,https://i-invdn-com.investing.com/trkd-images/LYNXMPEH9K06D_L.jpg,business,en,us,2021-10-21T05:35:59+00:00
Reuters,"Ukraine’s new daily coronavirus cases, deaths hit record","KYIV &#8212; Ukraine registered a record daily high of new coronavirus infections and related deaths, the health ministry said on Thursday. Ministry data showed 22,415 new cases over the past 24 hours, exceeding the previous high of 20,341 on April 3. There were also 546 new deaths, surpassing the Oct. 19 record of 538. The [&#8230;]",https://financialpost.com/pmn/business-pmn/ukraines-new-daily-coronavirus-cases-deaths-hit-record-2,Financial Post | Canada Business News,,business,en,us,2021-10-21T05:35:14+00:00
,NextPlay Technologies reports FQ2 results,NextPlay Technologies reports FQ2 results,https://seekingalpha.com/news/3755898-nextplay-technologies-reports-fq2-results?utm_source=feed_news_all&utm_medium=referral,Seeking Alpha,,business,en,us,2021-10-21T05:45:18+00:00
Peter Kennedy,Perrottet holds key with reopening,The Morrison government will be keenly watching the new NSW premier’s bold move to open the nation’s biggest economy.,https://www.businessnews.com.au/article/Perrottet-holds-key-with-reopening,Business News.com.au,https://static.businessnews.com.au/sites/default/files/articles-2021-10/CEBIT_Australia_-_Day_2%2C_The_Hon_Dominic_Perrottet_MP_%282%29.jpg,business,en,au,2021-10-21T06:00:00+00:00
,Tesla shows progress on profit as investors seek perfection,Elon Musk’s electric carmaker hasn’t been too troubled the semiconductor shortage and supply chain challenges that have stymied its rivals.,https://www.theage.com.au/business/companies/tesla-shows-progress-on-profit-as-investors-seek-perfection-20211021-p591ti.html?ref=rss&utm_medium=rss&utm_source=rss_business,The Age,,business,en,au,2021-10-21T05:57:51+00:00
Reuters,"Truck maker Volvo profit beats forecast, but chip woes linger","Truck maker Volvo profit beats forecast, but chip woes linger",https://www.investing.com/news/stock-market-news/truck-maker-ab-volvo-core-profit-beats-forecast-2650448,Investing.com | Stock Market Quotes &amp; Financial News,https://i-invdn-com.investing.com/trkd-images/LYNXMPEH9K07L_L.jpg,business,en,us,2021-10-21T06:16:20+00:00
Reuters,Swedbank profit tops forecast as commission income hits record,Swedbank profit tops forecast as commission income hits record,https://www.investing.com/news/economy/swedbank-profit-tops-forecast-as-commission-income-hits-record-2650457,Investing.com | Stock Market Quotes &amp; Financial News,https://i-invdn-com.investing.com/trkd-images/LYNXMPEH9K08C_L.jpg,business,en,us,2021-10-21T06:16:01+00:00
Reuters,"SAP's cloud business drives quarterly results, raised outlook","SAP's cloud business drives quarterly results, raised outlook",https://www.investing.com/news/stock-market-news/sap-confirms-raised-outlook-q3-results-2650439,Investing.com | Stock Market Quotes &amp; Financial News,https://i-invdn-com.investing.com/trkd-images/LYNXMPEH9K06U_L.jpg,business,en,us,2021-10-21T06:00:38+00:00
Bobby Ghosh,Meet the UAE’s Royal Troubleshooter — and Maybe Next Big Boss,Meet the UAE’s Royal Troubleshooter — and Maybe Next Big Boss,https://www.bloombergquint.com/gadfly/meet-uae-leader-sheikh-mohammed-s-new-royal-troubleshooter,Bloomberg | Latest And Live Business,,business,en,us,2021-10-21T06:00:40+00:00
Katarina Hoije,Chad ExxonMobil Unit Shuts In Production Site Over Labor Dispute,Chad ExxonMobil Unit Shuts In Production Site Over Labor Dispute,https://www.bloombergquint.com/markets/chad-exxonmobil-unit-shuts-in-production-site-over-labor-dispute,Bloomberg | Latest And Live Business,,business,en,us,2021-10-21T06:00:25+00:00
,"‘Triumph of Indian science’: PM Modi, others celebrate India’s 1 bn COVID-19 vaccinations mark","Soon after this news became public, the internet could not help but rejoice at India's big achievement in its fight against the coronavirus pandemic.",https://www.businesstoday.in/coronavirus/story/triumph-of-indian-science-pm-modi-others-celebrate-indias-1-bn-covid-19-vaccinations-mark-309986-2021-10-21?utm_source=rssfeed,Business Today | Latest Stock Market And Economy News India,,business,en,in,2021-10-21T06:25:09+00:00
Rafaela Lindeberg,Volvo Beats on Profit Despite Chip Crunch Weighing on Production,Volvo Beats on Profit Despite Chip Crunch Weighing on Production,https://www.bloombergquint.com/business/volvo-beats-estimate-despite-chip-crunch-weighing-on-production,Bloomberg | Latest And Live Business,,business,en,us,2021-10-21T06:25:22+00:00
Chris Strohm,House Set to Vote on Seeking Prosecution of Ex-Trump Aide Bannon,House Set to Vote on Seeking Prosecution of Ex-Trump Aide Bannon,https://www.bloombergquint.com/politics/house-set-to-vote-on-seeking-prosecution-of-ex-trump-aide-bannon,Bloomberg | Latest And Live Business,,business,en,us,2021-10-21T06:47:09+00:00
